{
  "$schema": "https://json-schema.org/draft/2020-12/schema",
  "title": "ProjectTemplate",
  "type": "object",
  "required": ["label", "description", "plan"],
  "properties": {
    "$schema": { "type": "string" },
    "label": { "type": "string" },
    "description": { "type": "string" },
    "wizardPages": {
      "type": "array",
      "items": { "$ref": "#/definitions/WizardPage" }
    },
    "lore": { "$ref": "#/definitions/TemplateProjectLore" },
    "plan": { "$ref": "#/definitions/TemplateProjectPlan" }
  },
  "additionalProperties": false,
  "definitions": {
    "WizardPage": {
      "type": "object",
      "required": ["id", "title", "fields"],
      "properties": {
        "id": { "type": "string" },
        "title": { "type": "string" },
        "description": { "type": "string" },
        "fields": { "type": "array", "items": { "$ref": "#/definitions/WizardField" } }
      },
      "additionalProperties": false
    },
    "BaseWizardField": {
      "type": "object",
      "required": ["name", "label", "type"],
      "properties": {
        "name": { "type": "string" },
        "label": { "type": "string" },
        "description": { "type": "string" },
        "type": { "type": "string" },
        "editableOnUpdate": {
          "description": "The update-from-template dialog offers this field for change. Leave it off for a field that only seeds what a node starts with, like a synopsis: an update never rewrites content.",
          "type": "boolean"
        }
      }
    },
    "WizardTextAreaField": {
      "allOf": [{ "$ref": "#/definitions/BaseWizardField" }],
      "properties": {
        "type": { "const": "textarea" },
        "placeholder": { "type": "string" }
      },
      "required": ["type"],
      "unevaluatedProperties": false
    },
    "WizardInputField": {
      "allOf": [{ "$ref": "#/definitions/BaseWizardField" }],
      "properties": {
        "type": { "const": "input" },
        "placeholder": { "type": "string" }
      },
      "required": ["type"],
      "unevaluatedProperties": false
    },
    "WizardSelectAgeRatingField": {
      "allOf": [{ "$ref": "#/definitions/BaseWizardField" }],
      "properties": {
        "type": { "const": "select-age-rating" },
        "defaultValue": {
          "description": "One of the AGE_RATING_ORDER values from shared/ai-engines.ts: G, PG, 12, 16, 18, NC21.",
          "type": "string"
        }
      },
      "required": ["type"],
      "unevaluatedProperties": false
    },
    "WizardSelectOption": {
      "type": "object",
      "required": ["value", "label"],
      "properties": {
        "value": {
          "description": "What the project stores for this choice. Never empty: a select cannot hold an empty value.",
          "type": "string",
          "minLength": 1
        },
        "label": { "type": "string" },
        "text": {
          "description": "What `${name}` becomes in the prompts; the value itself when absent. Kept apart from the value so a template can reword it and an update carries the new wording to existing projects.",
          "type": "string"
        }
      },
      "additionalProperties": false
    },
    "WizardSelectField": {
      "allOf": [{ "$ref": "#/definitions/BaseWizardField" }],
      "properties": {
        "type": { "const": "select" },
        "options": {
          "type": "array",
          "minItems": 1,
          "items": { "$ref": "#/definitions/WizardSelectOption" }
        },
        "defaultValue": {
          "description": "The value of one of the options.",
          "type": "string"
        }
      },
      "required": ["type", "options"],
      "unevaluatedProperties": false
    },
    "WizardIntegerField": {
      "allOf": [{ "$ref": "#/definitions/BaseWizardField" }],
      "properties": {
        "type": { "const": "integer" },
        "min": { "type": "integer" },
        "max": { "type": "integer" },
        "defaultValue": { "type": "integer" }
      },
      "required": ["type", "min", "max"],
      "unevaluatedProperties": false
    },
    "WizardAdviceField": {
      "description": "Read-only field that asks the configured LLM for a recommendation based on prior wizard values. The user clicks `buttonLabel`; the prompt (Handlebars over wizard field values) is sent to whichever engine the user picked on the AI-select page. Streams reasoning + answer back live. Only visible when an engine is configured.",
      "allOf": [{ "$ref": "#/definitions/BaseWizardField" }],
      "properties": {
        "type": { "const": "advice" },
        "buttonLabel": { "type": "string" },
        "placeholder": { "type": "string" },
        "prompt": {
          "description": "User-prompt template lines. Joined with newlines and rendered as Handlebars against the current wizard field values (use `{{fieldName}}`, no brackets needed since field names are plain identifiers).",
          "type": "array",
          "items": { "type": "string" }
        },
        "systemPrompt": {
          "description": "Optional system-prompt template lines. Same Handlebars context as `prompt`.",
          "type": "array",
          "items": { "type": "string" }
        }
      },
      "required": ["type", "buttonLabel", "prompt"],
      "unevaluatedProperties": false
    },
    "WizardField": {
      "oneOf": [
        { "$ref": "#/definitions/WizardInputField" },
        { "$ref": "#/definitions/WizardTextAreaField" },
        { "$ref": "#/definitions/WizardSelectAgeRatingField" },
        { "$ref": "#/definitions/WizardSelectField" },
        { "$ref": "#/definitions/WizardIntegerField" },
        { "$ref": "#/definitions/WizardAdviceField" }
      ]
    },
    "TemplateProjectLore": {
      "type": "object",
      "required": ["nodes"],
      "properties": {
        "nodes": { "type": "array", "items": { "$ref": "#/definitions/TemplateProjectLoreNode" } }
      },
      "additionalProperties": false
    },
    "TemplateProjectLoreNode": {
      "type": "object",
      "required": ["title"],
      "properties": {
        "title": { "type": "string" },
        "content": { "type": "array", "items": { "type": "string" } },
        "children": { "type": "array", "items": { "$ref": "#/definitions/TemplateProjectLoreNode" } }
      },
      "additionalProperties": false
    },
    "TemplateProjectPlan": {
      "type": "object",
      "required": ["nodes"],
      "properties": {
        "nodes": { "type": "array", "items": { "$ref": "#/definitions/TemplateProjectPlanNode" } }
      },
      "additionalProperties": false
    },
    "TemplateProjectPlanNode": {
      "type": "object",
      "required": ["title", "type"],
      "properties": {
        "title": { "type": "string" },
        "type": { "$ref": "plan-node-types.json#" },
        "x": { "type": "number" },
        "y": { "type": "number" },
        "width": { "type": "number" },
        "height": { "type": "number" },
        "aiUserInstructions": { "type": "array", "items": { "type": "string" } },
        "nodeTypeSettings": { "type": "object" },
        "aiSettings": {
          "type": "object",
          "description": "Optional per-node override of AI generation settings. Outer key is engine id (`grok`, `yandex`). Stored verbatim in plan_nodes.ai_settings; merged on top of the project-level defaults at LLM-call time. Example: `{ \"grok\": { \"reasoning_effort\": \"none\" } }`."
        },
        "content": { "type": "array", "items": { "type": "string" } },
        "children": { "type": "array", "items": { "$ref": "#/definitions/TemplateProjectPlanNode" } },
        "inputs": {
          "type": "array",
          "items": { "$ref": "#/definitions/TemplateProjectPlanNodeInput" }
        }
      },
      "additionalProperties": false
    },
    "TemplateProjectPlanNodeInput": {
      "type": "object",
      "required": ["sourceNodeTitle", "type"],
      "properties": {
        "sourceNodeTitle": { "type": "string" },
        "type": { "$ref": "plan-edge-types.json#" }
      },
      "additionalProperties": false
    }
  }
}
