{
  "label": "Novella or short novel (~30k words)",
  "description": "Generate a ~30,000-word novella from one short synopsis. Useful when you have an idea and want a full draft of it — original prose, fanfic of an existing canon, AU or what-if. Single hands-off run: the template derives the world, characters and plot itself, writes scenes in two passes, and auto-fixes style and plot holes.",
  "wizardPages": [
    {
      "id": "rating-and-synopsis",
      "title": "Rating and synopsis",
      "fields": [
        {
          "name": "ageRating",
          "type": "select-age-rating",
          "label": "Age rating",
          "description": "Drives character age bounds, allowed depth of dark / erotic scenes, and review style. The AI infers target audience from genre and theme. Not every AI engine supports every rating — 18+/NC-21 needs an engine that does.",
          "defaultValue": "16+"
        },
        {
          "name": "synopsis",
          "type": "textarea",
          "label": "Story synopsis",
          "description": "Describe the story freely: what it is about, who the characters are, what happens, what matters for atmosphere. The template derives theme, style, characters and plot outline itself.",
          "placeholder": "A young cartographer finds a map that shouldn't exist..."
        }
      ]
    },
    {
      "id": "chunks-count",
      "title": "Prose budget",
      "fields": [
        {
          "name": "chunksCount",
          "type": "integer",
          "min": 2,
          "max": 30,
          "defaultValue": 20,
          "label": "Prose chunks count",
          "description": "How many LLM calls to spend on prose. One call ≈ 1500 words — the novella is cut into N pieces and reassembled. The template picks the number of scenes from the synopsis. ~30k words = ~20 chunks."
        },
        {
          "name": "chunksCountAdvice",
          "type": "advice",
          "label": "LLM advice on length",
          "description": "If the synopsis is already filled in, ask the configured engine what number of chunks fits the story best.",
          "buttonLabel": "Ask for advice",
          "placeholder": "The LLM's chunk-count recommendation will appear here.",
          "prompt": [
            "Age rating: {{ageRating}}.",
            "",
            "Synopsis of the upcoming work:",
            "```",
            "{{synopsis}}",
            "```",
            "",
            "Based on the synopsis, suggest the best number of chunks for this work, given that each chunk is 1000–1500 words. Give 3 options (minimal, optimal, extended) with a concrete chunk count for each, and explain why. List the options briefly first (one line each), then the reasoning. In English."
          ]
        }
      ]
    }
  ],
  "plan": {
    "nodes": [
      {
        "title": "Synopsis",
        "type": "text",
        "x": 40,
        "y": 323,
        "content": ["${synopsis}"],
        "width": 200,
        "height": 80
      },
      {
        "title": "World draft",
        "type": "text",
        "x": 350,
        "y": 1237,
        "aiUserInstructions": [
          "## Age rating",
          "",
          "${ageRating}.{{#if (or (eq \"${ageRating}\" \"18+\") (eq \"${ageRating}\" \"NC-21\"))}} All characters are 18+ adults.{{/if}}",
          "",
          "## What to do",
          "",
          "Describe the world the story takes place in. Downstream nodes (setting, characters, plot) build on this description and don't contradict it. If a canon is named in the description, later nodes may use it as a source of extra detail — without diverging from what's fixed here.",
          "",
          "Cover in the description:",
          "- origin of the world — original, or based on a specific existing work / universe (with the source explicitly named on one line and the relationship stated: full borrowing, diverges in these rules, AU, what-if, in-universe continuation, etc.);",
          "- key rules and mechanics of the world — what makes it different from generic today (technology, magic, social institutions, what's possible and what isn't). For a realistic contemporary setting, one sentence stating the absence of such differences is enough;",
          "- important locations and concepts the synopsis names or implies.",
          "",
          "Recognisable names or places from someone else's universe in the synopsis are a reason to call out the source in the world description directly. Downstream generation goes only by this description.",
          "",
          "## Format",
          "",
          "Prose, no bullet points or numbering, no footnotes or URLs. In English. Write as much as needed for a self-contained world description; don't pad for volume, upper bound 1500 words. Don't print a word count in the output.",
          "",
          "Describe the world statically — facts, rules, places. Plot moves, emotional tone of the story, and commentary on how the narrative will unfold belong to downstream nodes.",
          "",
          "## Synopsis",
          "```",
          "{{[Synopsis]}}",
          "```"
        ],
        "inputs": [
          {
            "sourceNodeTitle": "Synopsis",
            "type": "text"
          }
        ],
        "width": 200,
        "height": 80
      },
      {
        "title": "World review: physics",
        "type": "fix-problems",
        "x": 630,
        "y": 1237,
        "nodeTypeSettings": {
          "sourceNodeTitleToFix": "World draft",
          "maxIterations": 2,
          "minSeverityToFix": 65,
          "foundProblemsTemplate": "Found problems",
          "aiUserInstructionsToFindProblems": [
            "## Age rating of the work",
            "",
            "${ageRating}.{{#if (or (eq \"${ageRating}\" \"18+\") (eq \"${ageRating}\" \"NC-21\"))}} All characters are at least 18 years old.{{/if}}",
            "",
            "## What to do",
            "",
            "Check the world description for one thing: does what it describes work the way it is described. Consistency with the synopsis, fidelity to the intent, style and completeness are not for this node — other nodes handle them.",
            "",
            "One test for every finding: picture the description filmed as a single unbroken take. It is visible that it wouldn't work — that's a finding. Doubt with nothing behind it is not a finding.",
            "",
            "The world's own declared rules (magic, technology, social institutions) are a given. Everything else is under check: whatever works in this world the way it works in ours.",
            "",
            "This is analysis, not the story: write no prose, compose no scenes, give no dialogue.",
            "",
            "## What to look for",
            "",
            "- **a device is described the way it does not work**: who physically changes an entry-phone code and with what; what falls inside a camera's field of view and what it records; where the call panel is, where the handset is, who buzzes whom in; what a door closer does; what the lock latches with and from which side, what happens when the door slams shut; where the power comes from. Severity 80;",
            "- **a building is described the way they are not built**: where an external stair is put and where it leads, what height its lowest flight starts at; what belongs on a facade and what on a blank end wall; where windows face and which way doors open; where the attic, cellar, service floor sit. Severity 75;",
            "- **sizes, heights, distances and durations are impossible or don't add up against each other**: a figure implausible on its own, or two figures in the file contradicting each other — that distance isn't covered in that time, a storey isn't that tall, that object doesn't fit a room of those dimensions. Severity 80;",
            "- **weather and materials do what they don't do**: wind of the stated force, snow, rain, ice, frost, heat; what carries a load and what tears, bends, slips, burns; how long something dries, cools, holds a mark. Severity 70;",
            "- **the central object is eyeballed**: the thing the plot is built around is described without a single quantity — no mass, no size, no speed, no height, no duration, nothing to estimate from. Severity 70;",
            "- **a physical claim about the central object doesn't add up**: run the numbers — mass, sail area, wind speed, height, time — and compare them against the claim. Numbers against the claim — Severity 90.",
            "",
            "## Output format",
            "",
            "A list of findings, one item each: a quote from the world description (one sentence), then what does not work about it, with a figure or an estimate wherever the finding is about quantities, then severity 0–100. Up to 60 words per finding. Do not print a word count in the output.",
            "",
            "Scale: 80–100 — a plot move or a scene collapses on it; 65–79 — a reader who knows the subject stumbles. Do not report findings weaker than 65.",
            "",
            "{{[World draft]}}",
            "```"
          ],
          "aiUserInstructionsToFixProblems": [
            "## Age rating of the work",
            "",
            "${ageRating}.{{#if (or (eq \"${ageRating}\" \"18+\") (eq \"${ageRating}\" \"NC-21\"))}} All characters are at least 18 years old.{{/if}}",
            "",
            "## What to do",
            "",
            "Rewrite the world description, removing the findings listed below. Change only what they name; carry the rest of the text over sentence by sentence.",
            "",
            "A fix is a replacement with something that works: a different device, a different building arrangement, a different figure, a different way of doing the same thing. After the fix the figures add up against each other and against the rest of the text.",
            "",